{
  "default": {
    "sender_name": "Anju Susan Raju",
    "sender_title": "Data Engineer",
    "sender_location": "Atlanta, GA",
    "preferred_signoff": "Best regards",
    "signature": "Anju Susan Raju\nData Engineer\nAtlanta, GA",
    "last_drafts": [
      "Subject: Application for Job Opening at [Company Name]\n\nDear Reni,\n\nI hope this message finds you well. I am writing to formally express my interest in the job opening at [Company Name] that was recently advertised. I have attached my CV for your review and consideration.\n\nWith a background in [Your Field/Industry], I believe my skills and experiences align well with the requirements of the position. I am eager to contribute to the team and leverage my expertise in [specific skills or experiences relevant to the job].\n\nThank you for considering my application. I look forward to the opportunity to discuss how I can contribute to the success of [Company Name].\n\nBest regards,\n\nAnju Susan Raju  \nData Engineer  \nAtlanta, GA  \n[Your Phone Number]  \n[Your Email Address]",
      "Subject: Application for Job Opening at Microland\n\nDear Reni,\n\nI hope this message finds you well. I am writing to express my interest in the recent job opening at Microland and to submit my resume for your consideration.\n\nHaving researched Microland and its commitment to innovation and excellence, I am excited about the opportunity to contribute to your esteemed team. My background and experience align well with the requirements of the position, and I am eager to bring my skills in [specific skills or experience relevant to the job] to support the company's goals.\n\nPlease find my resume attached for your review. I would greatly appreciate the opportunity to discuss my application further and explore how I can contribute to Microland's success.\n\nThank you for considering my application. I look forward to your response.\n\nBest regards,\n\nAnju Susan Raju  \nData Engineer  \nAtlanta, GA"
    ]
  }
}